{
  "approvalDates": [
    "2026-08-04"
  ],
  "comparisonEngineVersion": 1,
  "editorialReviewerIds": [
    "fixture-reviewer-a"
  ],
  "knownCaveats": [
    "Synthetic fixture translation text only. Never a real translation corpus."
  ],
  "licenses": {
    "fixture-antar-translation-v1": {
      "licenseCatalogId": "cc0-1.0",
      "licenseDisplayed": "CC0 fixture"
    }
  },
  "normalizationPolicyVersion": 1,
  "packageBuilderVersion": 1,
  "packageId": "fixture-translation-en-chapter-01-v1",
  "retrievalMetadata": {
    "editorialApprovalManifestPath": "fixture",
    "sourceRegistryPath": "fixture"
  },
  "secondReviewerIds": [
    "fixture-reviewer-b"
  ],
  "sourceChecksums": {
    "fixture-antar-translation-v1": "aaaaaaaaaaaaaaaaaaaaaaaaaaaaaaaaaaaaaaaaaaaaaaaaaaaaaaaaaaaaaaaa"
  },
  "sourceIds": [
    "fixture-antar-translation-v1"
  ],
  "sourceRoles": {
    "fixture-antar-translation-v1": "FIXTURE"
  },
  "sourceSelectionRationale": "Synthetic Translation foundation fixture only."
}
